{
  "$schema": "../schema/weapon.schema.json",
  "id": "long-fang-of-the-moon",
  "name": "Long Fang of the Moon",
  "type": "weapon",
  "version": "1.0.0",
  "author": "voodoo573",
  "source": "homebrew",
  "edition": "5e",
  "license": "CC-BY-4.0",
  "description": "Legendary magic weapon (requires attunement) from Level Up: Advanced 5th Edition. You gain a +3 bonus to attack and damage rolls made with this silvered longsword.\n\nWeapon attacks using long fang of the moon deal an extra 2d6 radiant damage against creatures. When you hit a shapeshifter with this weapon, it makes a DC 30 Constitution saving throw or reverts to its original form. If it fails this saving throw, you may choose to prevent the shapeshifter from transforming for up to 10 minutes.\n\nHearth applies the +3 and the extra 2d6 radiant on every hit. The shapeshifter save is tracked by hand.",
  "summary": "Legendary +3 silvered longsword dealing 2d6 extra radiant; forces shapeshifters back to true form.",
  "tags": [
    "longsword",
    "legendary",
    "radiant",
    "a5e"
  ],
  "credits": "Long Fang of the Moon is taken from the A5E System Reference Document (A5ESRD) by EN Publishing and available at A5ESRD.com, based on Level Up: Advanced 5th Edition, available at www.levelup5e.com. The A5ESRD is licensed under the Creative Commons Attribution 4.0 International License available at https://creativecommons.org/licenses/by/4.0/legalcode. Source: https://api.open5e.com/v1/magicitems/long-fang-of-the-moon-a5e/ (Open5e). Changes: converted to Hearth's weapon format.",
  "data": {
    "name": "Long Fang of the Moon",
    "damage": {
      "count": 1,
      "sides": 8
    },
    "type": "slashing",
    "kind": "melee",
    "props": [
      "versatile"
    ],
    "cat": "martial",
    "magicBonus": 3,
    "extraDamage": [
      {
        "count": 2,
        "sides": 6,
        "type": "radiant"
      }
    ]
  }
}
