{
  "$schema": "../schema/background.schema.json",
  "id": "guildmember",
  "name": "Guildmember",
  "type": "background",
  "version": "1.0.0",
  "author": "voodoo573",
  "source": "homebrew",
  "edition": "5e",
  "license": "CC-BY-4.0",
  "description": "Guildmember background from Level Up: Advanced 5th Edition (Adventurer's Guide). Ability Score Increases: +1 to Constitution and one other ability score. Skill Proficiencies: Two of your choice. Tool Proficiencies: Either one type of artisan’s tools, musical instrument, or vehicle. Equipment: One set of artisan's tools or one instrument, traveler's clothes, guild badge. Guild Business: While in a city or town, you can maintain a moderate lifestyle by plying your trade. Furthermore, the guild occasionally informs you of jobs that need doing. Completing such a job might require performing a downtime activity, or it might require a full adventure. The guild provides a modest reward if you're successful. Adventures and Advancement: Once you have completed several quests or endeavors advancing guild business, you may be promoted to guild officer. You gain access to more lucrative contracts. In addition, the guild supports you at a moderate lifestyle without you having to work. Hearth preset: Insight and Persuasion (the source lets you pick any two skills). Ability score increases, tool proficiencies and languages are applied by hand. No starting gold is listed in the source.",
  "summary": "A guild member who earns a living in any town and gets tipped off about jobs.",
  "tags": [
    "urban",
    "crafting",
    "a5e"
  ],
  "credits": "Guildmember is taken from the A5E System Reference Document (A5ESRD) by EN Publishing and available at A5ESRD.com, based on Level Up: Advanced 5th Edition, available at www.levelup5e.com. The A5ESRD is licensed under the Creative Commons Attribution 4.0 International License available at https://creativecommons.org/licenses/by/4.0/legalcode. Source: https://api.open5e.com/v2/backgrounds/a5e-ag_guildmember/ (Open5e). Changes: converted to Hearth's background format.",
  "data": {
    "name": "Guildmember",
    "skills": [
      "insight",
      "persuasion"
    ],
    "gold": 0,
    "equipment": [
      "One set of artisan's tools or one instrument",
      "Traveler's clothes",
      "Guild badge"
    ],
    "feature": {
      "name": "Guild Business",
      "desc": "While in a city or town, you can maintain a moderate lifestyle by plying your trade. Furthermore, the guild occasionally informs you of jobs that need doing. Completing such a job might require performing a downtime activity, or it might require a full adventure. The guild provides a modest reward if you're successful."
    }
  }
}
