{
  "$schema": "../schema/feat.schema.json",
  "id": "fortunate",
  "name": "Fortunate",
  "type": "feat",
  "version": "1.0.0",
  "author": "voodoo573",
  "source": "homebrew",
  "edition": "5e",
  "license": "CC-BY-4.0",
  "description": "Feat from Level Up: Advanced 5th Edition. Be it the gods, fate, or dumb luck, something is looking out for you. You may choose to invoke your luck to do the following: - Before determining the result of an attack roll, an ability check, or a saving throw, roll a second d20 and select which die to use. If you have disadvantage, you may instead spend a fate point to choose one of the d20 rolls and reroll it. - Before determining the result of an attack made against you, roll a second d20 and select which die to use. Multiple creatures with the Fortunate feat may invoke luck. If this occurs, the result is resolved as normal. You may invoke your luck up to three times per long rest. (Fate points are a Level Up rule; outside Level Up, ignore that clause.)",
  "summary": "Three times per long rest, roll a second d20 for an attack, check or save, or against an attack on you.",
  "tags": [
    "luck",
    "d20",
    "a5e"
  ],
  "credits": "Fortunate is taken from the A5E System Reference Document (A5ESRD) by EN Publishing and available at A5ESRD.com, based on Level Up: Advanced 5th Edition, available at www.levelup5e.com. The A5ESRD is licensed under the Creative Commons Attribution 4.0 International License available at https://creativecommons.org/licenses/by/4.0/legalcode. Source: https://api.open5e.com/v1/feats/fortunate/ (Open5e). Changes: converted to Hearth's feat format.",
  "data": {
    "id": "fortunate",
    "name": "Fortunate",
    "desc": "Be it the gods, fate, or dumb luck, something is looking out for you.\nYou may choose to invoke your luck to do the following:\n- Before determining the result of an attack roll, an ability check, or a saving throw, roll a second d20 and select which die to use. If you have disadvantage, you may instead spend a fate point to choose one of the d20 rolls and reroll it.\n- Before determining the result of an attack made against you, roll a second d20 and select which die to use.\nMultiple creatures with the Fortunate feat may invoke luck. If this occurs, the result is resolved as normal.\nYou may invoke your luck up to three times per long rest."
  }
}
