{
  "$schema": "../schema/monster.schema.json",
  "id": "vapor-lynx",
  "name": "Vapor Lynx",
  "type": "monster",
  "version": "1.0.1",
  "author": "voodoo573",
  "source": "homebrew",
  "edition": "5e",
  "license": "OGL-1.0a",
  "description": "CR 5 large monstrosity from Tome of Beasts (Kobold Press). AC 14 (natural armor), 127 HP. These great cats pad noiselessly, while tendrils of smoke drift off their sleek gray coats, leaving misty whorls in their wake. Their eyes shift from dull, pallid orbs to pitch black slits. Their lips curl up into a fang-revealing smile as their bodies fades into fog.\nSplit the Herd. Vapor lynxes are capricious hunters. Devious, manipulative, and mischievous, they toy with their prey before killing it. They rarely enjoy a stand-up fight, instead coalescing in and out of the fog to harass victims. Using their ability to solidify and poison the fog around them, they cut large groups into smaller, more manageable morsels.\nDreary Marshlands. Their tactics have earned vapor lynxes a nasty reputation and the occasional bounty on their heads. Additionally, their magical nature makes them valuable to practitioners of the magical arts, and their beautiful, thick coats tempt many a furrier into hunts they may not be prepared for. For these reasons, vapor lynxes avoid civilization, fearing organized reprisal. Instead they haunt marshes and swamps, where the natural fog makes hunting easier. If an intelligent humanoid passes their way, they are happy for a change in their diet.\nChatty with Dinner. Although reclusive, vapor lynxes are intelligent, speaking both Common and Sylvan. They are particularly prideful and take great joy in bantering with potential meals to belittle and frighten them. Survivors of vapor lynx encounters invariably mention their constant needling and self-aggrandizement.\nAverage damage (source wording): Bite: 17 (3d8 + 4) piercing damage; Claw: 13 (2d8 + 4) slashing damage.",
  "summary": "Large smoky cat that slips into fog and exhales poison mist.",
  "tags": [
    "monstrosity",
    "cat",
    "mid-cr",
    "tome-of-beasts"
  ],
  "credits": "Open Game Content from Tome of Beasts. Copyright 2016, Open Design; Authors Chris Harris, Dan Dillon, Rodrigo Garcia Carmona, and Wolfgang Baur. Published by Kobold Press (https://koboldpress.com/kpstore/product/tome-of-beasts-for-5th-edition-print/). Used under the Open Game License v1.0a (full licence and Section 15 in LICENSE-OGL.txt). Source data: https://api.open5e.com/v1/monsters/vapor-lynx/ (Open5e). Changes: converted to Hearth's monster format.",
  "data": {
    "name": "Vapor Lynx",
    "cr": 5.0,
    "size": "Large",
    "type": "monstrosity",
    "ac": 14,
    "hp": 127,
    "hpFormula": "15d10+45",
    "speed": {
      "walk": 50,
      "climb": 30
    },
    "abilities": {
      "str": 15,
      "dex": 18,
      "con": 16,
      "int": 10,
      "wis": 13,
      "cha": 14
    },
    "skills": {
      "perception": "+4",
      "stealth": "+7"
    },
    "senses": "darkvision 60 ft., passive Perception 14",
    "legendary": false,
    "traits": [
      {
        "name": "Languages",
        "desc": "Common, Sylvan"
      },
      {
        "name": "Innate Spellcasting",
        "desc": "the lynx's innate spellcasting ability is Charisma. It can cast the following spell, requiring no material components:\n\n3/day: gaseous form"
      },
      {
        "name": "Smoky Constitution",
        "desc": "The vapor lynx spends its time in both gaseous and solid form. Its unique constitution makes it immune to all fog- or gas-related spells and attacks, including its own. A vapor lynx sees clearly through light or heavy obscurement caused by fog, mist, or spells such as fog cloud."
      }
    ],
    "actions": [
      {
        "name": "Multiattack",
        "desc": "The vapor lynx makes one bite attack and two claw attacks."
      },
      {
        "name": "Bite",
        "desc": "Melee Weapon Attack: +7 to hit, reach 10 ft., one target. Hit: 3d8+4 piercing damage."
      },
      {
        "name": "Claw",
        "desc": "Melee Weapon Attack: +7 to hit, reach 10 ft., one target. Hit: 2d8+4 slashing damage."
      },
      {
        "name": "Poison Breath (Recharge 5-6)",
        "desc": "The vapor lynx exhales a 40- foot radius poison fog, which heavily obscures a spherical area around the lynx. Any breathing creature that ends its turn in the fog must make a DC 14 Constitution saving throw or become poisoned for 1d4 + 1 rounds."
      }
    ]
  }
}
