{
  "$schema": "../schema/background.schema.json",
  "id": "artisan",
  "name": "Artisan",
  "type": "background",
  "version": "1.0.0",
  "author": "voodoo573",
  "source": "homebrew",
  "edition": "5e",
  "license": "CC-BY-4.0",
  "description": "Artisan background from Level Up: Advanced 5th Edition (Adventurer's Guide). Ability Score Increases: +1 to Intelligence and one other ability score. Skill Proficiencies: Persuasion, and either Insight or History. Tool Proficiencies: One type of artisan’s tools or smith’s tools. Equipment: One set of artisan's tools, traveler's clothes. Trade Mark: When in a city or town, you have access to a fully-stocked workshop with everything you need to ply your trade. Furthermore, you can expect to earn full price when you sell items you have crafted (though there is no guarantee of a buyer). Adventures and Advancement: If you participate in the creation of a magic item (a “master work”), you will gain the services of up to 8 commoner apprentices with the appropriate tool proficiency. Hearth preset: Persuasion and Insight (the source lets you pick Insight or History). Ability score increases, tool proficiencies and languages are applied by hand. No starting gold is listed in the source.",
  "summary": "A crafter with a workshop in every town who sells their work at full price.",
  "tags": [
    "crafting",
    "urban",
    "a5e"
  ],
  "credits": "Artisan is taken from the A5E System Reference Document (A5ESRD) by EN Publishing and available at A5ESRD.com, based on Level Up: Advanced 5th Edition, available at www.levelup5e.com. The A5ESRD is licensed under the Creative Commons Attribution 4.0 International License available at https://creativecommons.org/licenses/by/4.0/legalcode. Source: https://api.open5e.com/v2/backgrounds/a5e-ag_artisan/ (Open5e). Changes: converted to Hearth's background format.",
  "data": {
    "name": "Artisan",
    "skills": [
      "persuasion",
      "insight"
    ],
    "gold": 0,
    "equipment": [
      "One set of artisan's tools",
      "Traveler's clothes"
    ],
    "feature": {
      "name": "Trade Mark",
      "desc": "When in a city or town, you have access to a fully-stocked workshop with everything you need to ply your trade. Furthermore, you can expect to earn full price when you sell items you have crafted (though there is no guarantee of a buyer)."
    }
  }
}
