{
  "$schema": "../schema/feat.schema.json",
  "id": "deflector",
  "name": "Deflector",
  "type": "feat",
  "version": "1.0.0",
  "author": "voodoo573",
  "source": "homebrew",
  "edition": "5e",
  "license": "CC-BY-4.0",
  "description": "Feat from Level Up: Advanced 5th Edition. Your lightning reflexes make you hard to hit. You may expend your reaction to increase your AC by an amount equal to your proficiency bonus against an attack targeting you in melee. This feat can only be used while holding a finesse weapon that you're proficient with.",
  "summary": "Reaction: add your proficiency bonus to AC against a melee attack while holding a finesse weapon.",
  "tags": [
    "defence",
    "reaction",
    "finesse",
    "a5e"
  ],
  "credits": "Deflector is taken from the A5E System Reference Document (A5ESRD) by EN Publishing and available at A5ESRD.com, based on Level Up: Advanced 5th Edition, available at www.levelup5e.com. The A5ESRD is licensed under the Creative Commons Attribution 4.0 International License available at https://creativecommons.org/licenses/by/4.0/legalcode. Source: https://api.open5e.com/v1/feats/deflector/ (Open5e). Changes: converted to Hearth's feat format.",
  "data": {
    "id": "deflector",
    "name": "Deflector",
    "desc": "Your lightning reflexes make you hard to hit.\nYou may expend your reaction to increase your AC by an amount equal to your proficiency bonus against an attack targeting you in melee.\nThis feat can only be used while holding a finesse weapon that you're proficient with.",
    "prerequisite": "Dexterity 13 or higher"
  }
}
