{
  "$schema": "../schema/feat.schema.json",
  "id": "shield-focus",
  "name": "Shield Focus",
  "type": "feat",
  "version": "1.0.0",
  "author": "voodoo573",
  "source": "homebrew",
  "edition": "5e",
  "license": "CC-BY-4.0",
  "description": "Feat from Level Up: Advanced 5th Edition. A shield is a nearly impassable barrier in your hands. - Using your shield, you may expend your bonus action to make a shove maneuver against an adjacent creature when you take the attack action. - When you have a shield in your hand, you may apply its AC bonus to dexterity saves made against effects that target you. - While wielding a shield, you may expend your reaction following a successful Dexterity saving throw to take no damage from a spell or effect.",
  "summary": "Bonus-action shield shoves, add your shield to Dexterity saves, and shrug off effects with a reaction.",
  "tags": [
    "shield",
    "defence",
    "a5e"
  ],
  "credits": "Shield Focus is taken from the A5E System Reference Document (A5ESRD) by EN Publishing and available at A5ESRD.com, based on Level Up: Advanced 5th Edition, available at www.levelup5e.com. The A5ESRD is licensed under the Creative Commons Attribution 4.0 International License available at https://creativecommons.org/licenses/by/4.0/legalcode. Source: https://api.open5e.com/v1/feats/shield-focus/ (Open5e). Changes: converted to Hearth's feat format.",
  "data": {
    "id": "shield_focus",
    "name": "Shield Focus",
    "desc": "A shield is a nearly impassable barrier in your hands.\n- Using your shield, you may expend your bonus action to make a shove maneuver against an adjacent creature when you take the attack action.\n- When you have a shield in your hand, you may apply its AC bonus to dexterity saves made against effects that target you.\n- While wielding a shield, you may expend your reaction following a successful Dexterity saving throw to take no damage from a spell or effect."
  }
}
