{
  "$schema": "../schema/feat.schema.json",
  "id": "stalwart",
  "name": "Stalwart",
  "type": "feat",
  "version": "1.0.1",
  "author": "voodoo573",
  "source": "homebrew",
  "edition": "5e",
  "license": "CC-BY-4.0",
  "description": "Feat from Level Up: Advanced 5th Edition. You can quickly recover from injuries that leave lesser creatures broken. - Raise your Constitution attribute by 1, up to the attribute cap of 20. - You regain an additional number of hit points equal to double your Constitution modifier (minimum 2) whenever you roll a hit die to regain hit points.",
  "summary": "+1 Constitution and extra healing whenever you roll a Hit Die.",
  "tags": [
    "constitution",
    "rest",
    "a5e"
  ],
  "credits": "Stalwart is taken from the A5E System Reference Document (A5ESRD) by EN Publishing and available at A5ESRD.com, based on Level Up: Advanced 5th Edition, available at www.levelup5e.com. The A5ESRD is licensed under the Creative Commons Attribution 4.0 International License available at https://creativecommons.org/licenses/by/4.0/legalcode. Source: https://api.open5e.com/v1/feats/stalwart/ (Open5e). Changes: converted to Hearth's feat format.",
  "data": {
    "id": "stalwart",
    "name": "Stalwart",
    "desc": "You can quickly recover from injuries that leave lesser creatures broken.\n- Raise your Constitution attribute by 1, up to the attribute cap of 20.\n- You regain an additional number of hit points equal to double your Constitution modifier (minimum 2) whenever you roll a hit die to regain hit points.",
    "abilityIncrease": {
      "con": 1
    }
  }
}
