{
  "$schema": "../schema/spell.schema.json",
  "id": "earth-barrier",
  "name": "Earth Barrier",
  "type": "spell",
  "version": "1.0.0",
  "author": "voodoo573",
  "source": "homebrew",
  "edition": "5e",
  "license": "CC-BY-4.0",
  "description": "Level 1 abjuration spell from Level Up: Advanced 5th Edition. Choose an unoccupied space between you and the source of the attack which triggers the spell. You call forth a pillar of earth or stone (3 feet diameter, 20 feet tall, AC 10, 20 hit points) in that space that provides you with three-quarters cover (+5 to AC, Dexterity saving throws, and ability checks made to hide).",
  "summary": "1st-level druid reaction: raise a stone pillar that gives you three-quarters cover.",
  "tags": [
    "defence",
    "reaction",
    "earth",
    "a5e"
  ],
  "credits": "Earth Barrier is taken from the A5E System Reference Document (A5ESRD) by EN Publishing and available at A5ESRD.com, based on Level Up: Advanced 5th Edition, available at www.levelup5e.com. The A5ESRD is licensed under the Creative Commons Attribution 4.0 International License available at https://creativecommons.org/licenses/by/4.0/legalcode. Source: https://api.open5e.com/v1/spells/earth-barrier-a5e/ (Open5e). Changes: converted to Hearth's spell format.",
  "data": {
    "name": "Earth Barrier",
    "level": 1,
    "school": "abjuration",
    "classes": [
      "druid"
    ],
    "time": "reaction",
    "range": "30 ft",
    "components": "V, S",
    "duration": "1 minute",
    "desc": "Cast as a reaction when you are targeted with a ranged attack. Choose an unoccupied space between you and the source of the attack which triggers the spell. You call forth a pillar of earth or stone (3 feet diameter, 20 feet tall, AC 10, 20 hit points) in that space that provides you with three-quarters cover (+5 to AC, Dexterity saving throws, and ability checks made to hide).",
    "kind": "utility"
  }
}
